{
  "matrix_id": "ISHI::E2026-01-23-001",
  "event_id": "E2026-01-23-001",
  "asset_id": "PUMP_A_01",
  "generated_at": "2026-05-01T16:07:43.234434+00:00",
  "categories": [
    {
      "category": "equipment_hardware",
      "rows": [
        {
          "factor_id": "equipment::CMP_BRG",
          "label": "CMP_BRG",
          "source_artifact": "kg_context",
          "linked_candidate_ids": [],
          "supporting_evidence_ids": [],
          "strength": 0.25,
          "notes": {
            "seed_match_type": "seed"
          },
          "temporal_relation": null,
          "telemetry_signals": [],
          "category": "equipment_hardware"
        }
      ]
    },
    {
      "category": "process_procedure",
      "rows": [
        {
          "factor_id": "process::CR:DEMO:0001",
          "label": "Procedure/documentary evidence from CR:DEMO:0001",
          "source_artifact": "evidence_bundle",
          "linked_candidate_ids": [],
          "supporting_evidence_ids": [
            "SNIP_001"
          ],
          "strength": 0.9,
          "notes": {
            "snippet": "Bearing wear suspected"
          },
          "temporal_relation": null,
          "telemetry_signals": [],
          "category": "process_procedure"
        }
      ]
    },
    {
      "category": "measurement_instrumentation",
      "rows": [
        {
          "factor_id": "measurement::S1_VIB",
          "label": "Signal anomaly on S1_VIB",
          "source_artifact": "telemetry_summary",
          "linked_candidate_ids": [],
          "supporting_evidence_ids": [],
          "strength": 0.5,
          "notes": {
            "parameter": "vibration",
            "unit": "mm/s",
            "anomaly_count": 1
          },
          "temporal_relation": "simultaneous",
          "telemetry_signals": [
            "S1_VIB"
          ],
          "category": "measurement_instrumentation"
        }
      ]
    },
    {
      "category": "environment_operating_context",
      "rows": [
        {
          "factor_id": "environment::operational_context",
          "label": "Operating context influence",
          "source_artifact": "operational_context",
          "linked_candidate_ids": [],
          "supporting_evidence_ids": [],
          "strength": 0.4,
          "notes": {
            "event_id": "E2026-01-23-001",
            "asset_id": "PUMP_A_01",
            "generated_at": "2026-01-23T10:15:00Z",
            "mode": "steady_state",
            "operating_mode": "steady_state",
            "percent_rated_power": 100.0,
            "power_mw": null,
            "window": {
              "start": "2026-01-23T09:00:00Z",
              "end": "2026-01-23T10:30:00Z"
            },
            "train_configuration": {
              "train_id": "PUMP_A_01",
              "in_service": true
            },
            "recent_alarms": [],
            "recent_operations": [],
            "nearby_maintenance": []
          },
          "temporal_relation": null,
          "telemetry_signals": [],
          "category": "environment_operating_context"
        }
      ]
    },
    {
      "category": "maintenance_human_factors",
      "rows": []
    }
  ],
  "summary": {
    "row_count": 4,
    "category_count": 4,
    "top_candidate_ids": []
  },
  "provenance": {
    "generated_by": "HeuristicIshikawaEvaluatorV1",
    "run_id": "55632728-901c-45a4-b57c-90183ce42a4e"
  }
}