{
  "matrix_id": "ISHI::E2026-01-23-001",
  "event_id": "E2026-01-23-001",
  "asset_id": "PUMP_A_01",
  "generated_at": "2026-03-26T21:05:03.915494+00:00",
  "categories": [
    {
      "category": "equipment_hardware",
      "rows": [
        {
          "factor_id": "equipment_hardware::FM::FM_BEARING_WEAR",
          "label": "Bearing wear",
          "source_artifact": "causality_candidates",
          "linked_candidate_ids": [
            "FM::FM_BEARING_WEAR"
          ],
          "supporting_evidence_ids": [
            "SNIP_001"
          ],
          "strength": 0.78,
          "notes": {
            "structural": "Bearing wear is structurally linked to the affected component.",
            "temporal": "Temporal pattern is consistent with observed anomaly timing.",
            "telemetry": "Telemetry anomaly magnitude supports the bearing-wear hypothesis.",
            "evidence": "Processed document evidence supports the failure mode.",
            "governance": "Governance contribution is moderate based on PM context."
          },
          "temporal_relation": "simultaneous",
          "telemetry_signals": [
            "S1_VIB"
          ],
          "category": "equipment_hardware"
        },
        {
          "factor_id": "equipment::CMP_BRG",
          "label": "CMP_BRG",
          "source_artifact": "kg_context",
          "linked_candidate_ids": [],
          "supporting_evidence_ids": [],
          "strength": 0.25,
          "notes": {
            "seed_match_type": "seed"
          },
          "temporal_relation": null,
          "telemetry_signals": [],
          "category": "equipment_hardware"
        }
      ]
    },
    {
      "category": "process_procedure",
      "rows": [
        {
          "factor_id": "process::CR:DEMO:0001",
          "label": "Procedure/documentary evidence from CR:DEMO:0001",
          "source_artifact": "evidence_bundle",
          "linked_candidate_ids": [],
          "supporting_evidence_ids": [
            "SNIP_001"
          ],
          "strength": 0.9,
          "notes": {
            "snippet": "Bearing wear suspected"
          },
          "temporal_relation": null,
          "telemetry_signals": [],
          "category": "process_procedure"
        }
      ]
    },
    {
      "category": "measurement_instrumentation",
      "rows": [
        {
          "factor_id": "measurement::S1_VIB",
          "label": "Signal anomaly on S1_VIB",
          "source_artifact": "telemetry_summary",
          "linked_candidate_ids": [],
          "supporting_evidence_ids": [],
          "strength": 0.5,
          "notes": {
            "parameter": "vibration",
            "unit": "mm/s",
            "anomaly_count": 1
          },
          "temporal_relation": "simultaneous",
          "telemetry_signals": [
            "S1_VIB"
          ],
          "category": "measurement_instrumentation"
        }
      ]
    },
    {
      "category": "environment_operating_context",
      "rows": [
        {
          "factor_id": "environment::event_severity",
          "label": "Event severity context",
          "source_artifact": "event",
          "linked_candidate_ids": [],
          "supporting_evidence_ids": [],
          "strength": 0.2,
          "notes": {
            "severity": "HIGH"
          },
          "temporal_relation": null,
          "telemetry_signals": [],
          "category": "environment_operating_context"
        }
      ]
    },
    {
      "category": "maintenance_human_factors",
      "rows": []
    }
  ],
  "summary": {
    "row_count": 5,
    "category_count": 4,
    "top_candidate_ids": [
      "FM::FM_BEARING_WEAR"
    ]
  },
  "provenance": {
    "generated_by": "HeuristicIshikawaEvaluatorV1",
    "run_id": "e179de79-f023-40df-98fb-2e273cbd2d44"
  }
}